Blocker,Why_it_matters,Evidence,Action,Preliminary_Go_NoGo
"Single tender only — no multiple tenders permitted","Submitting more than one bid results in automatic disqualification","Multiple Tenders: Ei sallittu [Not permitted] — TED BT-769","Confirm your organisation will submit exactly one offer","No-Go (deadline passed) — pending corrigendum check"
"No variants permitted","Any alternative technical solution submitted alongside the main bid will be rejected","Variants: Ei sallittu [Not permitted] — TED BT-63","Ensure bid contains no alternative proposals","No-Go (deadline passed) — pending corrigendum check"
"Submission deadline already passed","Deadline was 23 April 2026 at 12:00 (UTC+03:00); today is 28 April 2026","Deadline Receipt Tenders: 23.4.2026 12:00 — TED BT-131","Confirm whether a corrigendum or extended deadline has been issued in Cloudia; if not, this tender is closed","No-Go (deadline passed) — pending corrigendum check"
"Supplier suitability / qualification criteria not met","Eligibility requires meeting unspecified suitability criteria; non-compliant bids are excluded before price comparison","Selection criteria are indicated in the procurement documents — TED BT-821","Retrieve and review full qualification criteria from the procurement documents on Cloudia","No-Go (deadline passed) — pending corrigendum check"
"Exclusion grounds not met","Mandatory exclusion grounds apply; failure to satisfy them results in rejection regardless of price","Exclusion Grounds are indicated in the procurement documents — TED BT-806","Verify your organisation has no grounds for exclusion (e.g. tax arrears, criminal convictions, misrepresentation)","No-Go (deadline passed) — pending corrigendum check"
"Electronic invoicing mandatory","Inability to issue e-invoices in the required Finnish standard would constitute non-compliance","Electronic Invoicing: Pakollinen [Mandatory] — TED BT-743","Confirm your finance system can issue compliant Finnish e-invoices (Finvoice or PEPPOL)","No-Go (deadline passed) — pending corrigendum check"
"Construction-period bond of 10% required","Failure to provide the required bond makes the contract non-executable; inability to arrange it is a practical blocker","Rakennusajan vakuus on 10 % arvonlisäverottomasta urakkahinnasta (YSE 36 §) — TED BT-75","Confirm your organisation can obtain a surety bond at 10% of the contract value (est. ~€90,000 excl. VAT)","No-Go (deadline passed) — pending corrigendum check"
"Regulatory approvals pending — scope/schedule risk","Work on Solistinkatu northern section and Rata-aukio 2 may be legally prohibited or delayed; contract scope could shrink after award","Hallinto-oikeudella on mahdollisuus kieltää kadunpidon aloittaminen… Rakennusluvan käsittely on parhaillaan käynnissä — TED BT-300","Assess whether your pricing and programme can accommodate a reduced or delayed scope without commercial harm","No-Go (deadline passed) — pending corrigendum check"