Blocker,Why_it_matters,Evidence,Action,Preliminary_Go_NoGo
"Missing mandatory documents — full compliance checklist required","All eight statutory documents (or Beställaransvarsdokument alternative) must be attached to the bid; any omission causes rejection","Skatteintyg… TyEL… bankgaranti… handelsregistret… ELLER Beställaransvarsdokument… FÖRTECKNINGEN SKA BIFOGAS ANBUDET — Bilageförteckning","Confirm your organisation can produce all eight documents dated within 3 months, or obtain a valid Beställaransvarsdokument as the single alternative","Needs verification — deadline open, but document readiness must be confirmed"
"Documents must not be older than 3 months","Any certificate dated before late February 2026 relative to submission date will render the bid non-compliant","Utredningarna får inte vara äldre än tre månader — Bilageförteckning","Check issue dates of all held certificates now; order fresh ones immediately where needed","Needs verification — deadline open, but document readiness must be confirmed"
"Named responsible site manager required in bid","Bid is technically non-compliant if no named arbetsledare is included; cannot be corrected after submission","I anbudet ska en ansvarig arbetsledare anges — Anbudsförfrågan","Identify and confirm a named, qualified site manager before bid is prepared","Needs verification — deadline open, but document readiness must be confirmed"
"Mandatory pre-bid site visit — failure to attend may affect compliance","Contractor is explicitly required to visit the site before submitting; pricing without a visit risks non-conforming bid","Entreprenören skall bekanta sig med objektet… före inlämnande av anbud — Anbudsförfrågan","Contact Mats Nordgren (+358 504419262) immediately to book a site visit before the questions deadline of 15 May 2026","Needs verification — deadline open, but document readiness must be confirmed"
"Own liability and accident insurance mandatory","Contractor must hold and demonstrate its own damage and accident insurance; absence is a compliance failure","Entreprenören ska ha egen skade- och olycksfallsförsäkring — Anbudsförfrågan","Confirm current insurance cover and that the certificate can be included in the bid package","Needs verification — deadline open, but document readiness must be confirmed"
"Construction-period bond (10%) and defects liability bond (2%) required","Inability to provide either bond prevents contract execution and may disqualify the bid","Säkerhet för byggtiden 10%… garantitiden 2%… giltig 27 månader från godkänd slutbesiktning — Anbudsförfrågan","Confirm bond availability with your bank or insurer; obtain indicative costs against est. contract value of €250,000","Needs verification — deadline open, but document readiness must be confirmed"
"Signed list of received drawings must be attached","The Förteckning över mottagna ritningar och handlingar must be signed and included; omission is a formal non-compliance","Förteckning över mottagna ritningar… VI intygar härmed… FÖRTECKNINGEN SKA BIFOGAS ANBUDET — Förteckning document","Download all listed VVS (16 docs) and EL (6 docs) drawings from Hilma; sign and attach the receipt list to the bid","Needs verification — deadline open, but document readiness must be confirmed"
"Buyer retains right to reject any bid","The contracting authority may accept or reject any offer without obligation; abnormally low bids are at particular risk","Beställaren förbehåller sig rätten att godkänna eller förkasta givna anbud — Anbudsförfrågan","Ensure pricing is cost-supported and not aggressively below market; document rationale for all cost items","Needs verification — deadline open, but document readiness must be confirmed"